"DESCRIPTION","DURATION IN MS","NAME","PARENT SUITE","START TIME","STATUS","STOP TIME","SUB SUITE","SUITE","TEST CLASS","TEST METHOD"
"Проверка успешного входа пользователя с корректными данными","2891","Вход с валидными учетными данными","tests","Wed Oct 01 18:56:30 UTC 2025","passed","Wed Oct 01 18:56:33 UTC 2025","TestLogin","test_login","",""
"Проверка валидации при отсутствии пароля","1380","Вход с пустым паролем","tests","Wed Oct 01 18:56:44 UTC 2025","passed","Wed Oct 01 18:56:45 UTC 2025","TestLogin","test_login","",""
"Проверка валидации при отсутствии email","1371","Вход с пустым email","tests","Wed Oct 01 18:56:42 UTC 2025","passed","Wed Oct 01 18:56:43 UTC 2025","TestLogin","test_login","",""
"Проверка корректности URL после успешной аутентификации","1998","Проверка URL после успешного входа","tests","Wed Oct 01 18:56:33 UTC 2025","passed","Wed Oct 01 18:56:35 UTC 2025","TestLogin","test_login","",""
"Проверка что все элементы видимы пользователю","1215","Видимость элементов на странице входа","tests","Wed Oct 01 18:56:40 UTC 2025","passed","Wed Oct 01 18:56:42 UTC 2025","TestLogin","test_login","",""
"Проверка что система требует заполнения всех полей","1301","Вход с пустыми полями","tests","Wed Oct 01 18:56:37 UTC 2025","passed","Wed Oct 01 18:56:39 UTC 2025","TestLogin","test_login","",""
"Проверка что система не пропускает пользователя с неверными данными","1465","Вход с неверными учетными данными","tests","Wed Oct 01 18:56:36 UTC 2025","passed","Wed Oct 01 18:56:37 UTC 2025","TestLogin","test_login","",""
"Проверка что все необходимые элементы присутствуют на странице","1244","Наличие элементов на странице входа","tests","Wed Oct 01 18:56:39 UTC 2025","passed","Wed Oct 01 18:56:40 UTC 2025","TestLogin","test_login","",""
